{
  "$schema": "https://json-schema.org/draft/2020-12/schema",
  "$id": "phase-00-w2-credential-exposure-r1",
  "type": "object",
  "required": [
    "$schema",
    "schemaVersion",
    "evidenceId",
    "phaseStartSha",
    "authoredBy",
    "validatedBy",
    "claimStatus",
    "records",
    "canonicalOwnership",
    "exposureSets",
    "targetVerification"
  ],
  "properties": {
    "$schema": {
      "const": "./schemas/credential-exposure-matrix.schema.json"
    },
    "schemaVersion": {
      "const": 1
    },
    "evidenceId": {
      "const": "P0.W2.CREDENTIAL_EXPOSURE_MATRIX"
    },
    "phaseStartSha": {
      "const": "c72fd201867b9bcd1ef77d5e0f95ba379adb4fca"
    },
    "authoredBy": {
      "const": "phase-00-remediation-w2-final-r1-source-review"
    },
    "validatedBy": {
      "const": "scripts/hosted-web/phase-0/provider-runtime/scan-runtime-surfaces.ts"
    },
    "claimStatus": {
      "const": "source_observed_not_target_verified"
    },
    "records": {
      "type": "array",
      "minItems": 4,
      "items": {
        "type": "object",
        "required": [
          "id",
          "executionUnit",
          "providerSet",
          "currentExposureClasses",
          "currentIsolation",
          "finding",
          "targetRule",
          "executionUnitId",
          "source",
          "probeTest",
          "claimStatus",
          "exposureSetIds"
        ],
        "properties": {
          "id": {
            "type": "string",
            "minLength": 1
          },
          "executionUnit": {
            "type": "string",
            "minLength": 1
          },
          "providerSet": {
            "type": "array",
            "uniqueItems": true,
            "items": {
              "enum": ["anthropic", "codex", "gemini", "opencode"]
            }
          },
          "currentExposureClasses": {
            "type": "array",
            "uniqueItems": true,
            "items": {
              "type": "string",
              "minLength": 1
            }
          },
          "currentIsolation": {
            "type": "string",
            "minLength": 1
          },
          "finding": {
            "type": "string",
            "minLength": 1
          },
          "targetRule": {
            "type": "string",
            "minLength": 1
          },
          "executionUnitId": {
            "type": "string",
            "minLength": 1
          },
          "source": {
            "type": "string",
            "minLength": 1
          },
          "probeTest": {
            "type": "string",
            "minLength": 1
          },
          "claimStatus": {
            "const": "source_observed_not_target_verified"
          },
          "exposureSetIds": {
            "type": "array",
            "uniqueItems": true,
            "items": {
              "enum": [
                "ces-ambient-unbounded",
                "ces-provider-secret-material",
                "ces-target-ingress-relay-secret",
                "ces-host-only-denied",
                "ces-runtime-metadata"
              ]
            }
          }
        },
        "additionalProperties": false
      }
    },
    "canonicalOwnership": {
      "type": "object",
      "required": [
        "providerSettingsAndAuth",
        "teamLaunchStopDelete",
        "runtimeIngress",
        "permissionDirection"
      ],
      "properties": {
        "providerSettingsAndAuth": {
          "type": "string",
          "minLength": 1
        },
        "teamLaunchStopDelete": {
          "type": "string",
          "minLength": 1
        },
        "runtimeIngress": {
          "type": "string",
          "minLength": 1
        },
        "permissionDirection": {
          "type": "string",
          "minLength": 1
        }
      },
      "additionalProperties": false
    },
    "exposureSets": {
      "type": "array",
      "minItems": 5,
      "items": {
        "type": "object",
        "required": [
          "id",
          "executionUnitIds",
          "secretClass",
          "currentStatus",
          "targetStatus",
          "memberKeyEvidenceIds",
          "provenanceArtifact",
          "probeTest"
        ],
        "properties": {
          "id": {
            "enum": [
              "ces-ambient-unbounded",
              "ces-provider-secret-material",
              "ces-target-ingress-relay-secret",
              "ces-host-only-denied",
              "ces-runtime-metadata"
            ]
          },
          "executionUnitIds": {
            "type": "array",
            "minItems": 1,
            "uniqueItems": true,
            "items": {
              "enum": [
                "unit-primary-provisioning",
                "unit-opencode-bridge",
                "unit-runtime-relay-target"
              ]
            }
          },
          "secretClass": {
            "enum": [
              "ambient_unknown_may_contain_secret",
              "runtime_ingress_bearer",
              "provider_credential_or_reference",
              "host_only_or_injection_sensitive",
              "non_secret_configuration"
            ]
          },
          "currentStatus": {
            "type": "string",
            "minLength": 1
          },
          "targetStatus": {
            "type": "string",
            "minLength": 1
          },
          "memberKeyEvidenceIds": {
            "type": "array",
            "minItems": 1,
            "uniqueItems": true,
            "items": {
              "type": "string",
              "minLength": 1
            }
          },
          "provenanceArtifact": {
            "const": "docs/research/hosted-web/phase-0/provider-runtime/environment-provenance.json"
          },
          "probeTest": {
            "type": "string",
            "minLength": 1
          }
        },
        "additionalProperties": false
      }
    },
    "targetVerification": {
      "type": "string",
      "minLength": 1
    }
  },
  "additionalProperties": false
}
