{
  "$schema": "./schemas/credential-exposure-matrix.schema.json",
  "schemaVersion": 1,
  "evidenceId": "P0.W2.CREDENTIAL_EXPOSURE_MATRIX",
  "phaseStartSha": "c72fd201867b9bcd1ef77d5e0f95ba379adb4fca",
  "authoredBy": "phase-00-remediation-w2-final-r1-source-review",
  "validatedBy": "scripts/hosted-web/phase-0/provider-runtime/scan-runtime-surfaces.ts",
  "claimStatus": "source_observed_not_target_verified",
  "records": [
    {
      "id": "unit-primary-provisioning",
      "executionUnit": "shared provisioning CLI primary",
      "providerSet": ["anthropic", "codex", "gemini"],
      "currentExposureClasses": [
        "ambient_process_environment",
        "selected_lead_auth",
        "cross_provider_member_auth",
        "provider_account_storage"
      ],
      "currentIsolation": "shared_execution_unit",
      "finding": "Cross-provider setup deliberately unions safe Codex metadata and required Anthropic auth into one child; whole process/shell env inheritance can widen it further.",
      "targetRule": "persist the minimum SecretRef-class union in CompositeRuntimePlan; no per-member isolation claim inside this process",
      "executionUnitId": "unit-primary-provisioning",
      "source": "src/main/services/team/provisioning/TeamProvisioningEnvBuilder.ts",
      "probeTest": "test/architecture/hosted-web/phase-0/provider-runtime/scan-runtime-surfaces.test.ts",
      "claimStatus": "source_observed_not_target_verified",
      "exposureSetIds": [
        "ces-ambient-unbounded",
        "ces-provider-secret-material",
        "ces-host-only-denied",
        "ces-runtime-metadata"
      ]
    },
    {
      "id": "unit-opencode-bridge",
      "executionUnit": "OpenCode bridge/side process",
      "providerSet": ["opencode"],
      "currentExposureClasses": [
        "ambient_process_environment",
        "runtime_binary_metadata",
        "mcp_launch_metadata",
        "app_identity_metadata"
      ],
      "currentIsolation": "dedicated_process_but_exposure_not_disjoint",
      "finding": "Bridge env starts from process.env; a separate process is therefore not proof of credential isolation.",
      "targetRule": "dedicated_execution_unit only after an allowlisted environment proves a disjoint CredentialExposureSet",
      "executionUnitId": "unit-opencode-bridge",
      "source": "src/main/services/team/runtime/OpenCodeTeamRuntimeAdapter.ts",
      "probeTest": "test/architecture/hosted-web/phase-0/provider-runtime/scan-runtime-surfaces.test.ts",
      "claimStatus": "source_observed_not_target_verified",
      "exposureSetIds": ["ces-ambient-unbounded", "ces-host-only-denied", "ces-runtime-metadata"]
    },
    {
      "id": "unit-runtime-relay-target",
      "executionUnit": "controller-owned lane relay (target only)",
      "providerSet": ["anthropic", "codex", "gemini", "opencode"],
      "currentExposureClasses": [],
      "currentIsolation": "not_implemented",
      "finding": "No canonical relay or /api/runtime/v1 credential exists at phaseStartSha.",
      "targetRule": "plaintext opaque lane credential enters relay over one-use inherited pipe; provider gets only narrow local capability",
      "executionUnitId": "unit-runtime-relay-target",
      "source": "docs/hosted-web-e2e-completion-plan.md",
      "probeTest": "test/architecture/hosted-web/phase-0/provider-runtime/scan-runtime-surfaces.test.ts",
      "claimStatus": "source_observed_not_target_verified",
      "exposureSetIds": ["ces-target-ingress-relay-secret"]
    },
    {
      "id": "unit-browser",
      "executionUnit": "operator browser session",
      "providerSet": [],
      "currentExposureClasses": ["browser_session"],
      "currentIsolation": "target_trust_surface_only",
      "finding": "Current local HTTP namespace does not yet prove the hosted split.",
      "targetRule": "browser session cannot authenticate runtime ingress; runtime credential cannot authorize operator verbs",
      "executionUnitId": "unit-browser",
      "source": "docs/hosted-web-e2e-completion-plan.md",
      "probeTest": "test/architecture/hosted-web/phase-0/provider-runtime/scan-runtime-surfaces.test.ts",
      "claimStatus": "source_observed_not_target_verified",
      "exposureSetIds": []
    }
  ],
  "canonicalOwnership": {
    "providerSettingsAndAuth": "provider.management.* operator actions on /api/hosted/v1 only",
    "teamLaunchStopDelete": "team.lifecycle.* operator actions on /api/hosted/v1 only",
    "runtimeIngress": "machine-only runtime.* observations/requests on /api/runtime/v1; never operator decisions",
    "permissionDirection": "runtime submits a permission request; operator policy/API owns the decision; an outbound adapter delivers it"
  },
  "exposureSets": [
    {
      "id": "ces-ambient-unbounded",
      "executionUnitIds": ["unit-primary-provisioning", "unit-opencode-bridge"],
      "secretClass": "ambient_unknown_may_contain_secret",
      "currentStatus": "open-ended process and shell inheritance; not a bounded credential set",
      "targetStatus": "forbidden until every admitted key is explicitly classified",
      "memberKeyEvidenceIds": ["env-key:interactiveShellEnv.*", "env-key:process.env.*"],
      "provenanceArtifact": "docs/research/hosted-web/phase-0/provider-runtime/environment-provenance.json",
      "probeTest": "test/architecture/hosted-web/phase-0/provider-runtime/scan-runtime-surfaces.test.ts#proves-every-per-key-provenance-and-exposure-binding"
    },
    {
      "id": "ces-provider-secret-material",
      "executionUnitIds": ["unit-primary-provisioning"],
      "secretClass": "provider_credential_or_reference",
      "currentStatus": "selected provider material may enter the shared primary unit; ambient inheritance may widen exposure",
      "targetStatus": "minimum SecretRef-class union for the resolved provider plan",
      "memberKeyEvidenceIds": [
        "env-key:ANTHROPIC_API_KEY",
        "env-key:ANTHROPIC_AUTH_TOKEN",
        "env-key:ANTHROPIC_AWS_API_KEY",
        "env-key:CLAUDE_CODE_API_KEY_FILE_DESCRIPTOR",
        "env-key:CLAUDE_CODE_BOOTSTRAP_PROOF_TOKEN",
        "env-key:CLAUDE_CODE_OAUTH_TOKEN",
        "env-key:CLAUDE_CODE_OAUTH_TOKEN_FILE_DESCRIPTOR",
        "env-key:CLAUDE_TEAM_ANTHROPIC_API_KEY_HELPER_SETTINGS_PATH",
        "env-key:CLAUDE_TEAM_DISABLE_ANTHROPIC_API_KEY_HELPER",
        "env-key:CODEX_API_KEY",
        "env-key:GEMINI_API_KEY",
        "env-key:GOOGLE_APPLICATION_CREDENTIALS",
        "env-key:OPENAI_API_KEY"
      ],
      "provenanceArtifact": "docs/research/hosted-web/phase-0/provider-runtime/environment-provenance.json",
      "probeTest": "test/architecture/hosted-web/phase-0/provider-runtime/scan-runtime-surfaces.test.ts#proves-every-per-key-provenance-and-exposure-binding"
    },
    {
      "id": "ces-target-ingress-relay-secret",
      "executionUnitIds": ["unit-runtime-relay-target"],
      "secretClass": "runtime_ingress_bearer",
      "currentStatus": "not implemented at canonical base",
      "targetStatus": "relay-only one-use inherited pipe; never provider child, argv, settings, MCP config, or browser",
      "memberKeyEvidenceIds": ["env-key:runtime-ingress bearer in any environment key"],
      "provenanceArtifact": "docs/research/hosted-web/phase-0/provider-runtime/environment-provenance.json",
      "probeTest": "test/architecture/hosted-web/phase-0/provider-runtime/scan-runtime-surfaces.test.ts#proves-every-per-key-provenance-and-exposure-binding"
    },
    {
      "id": "ces-host-only-denied",
      "executionUnitIds": ["unit-primary-provisioning", "unit-opencode-bridge"],
      "secretClass": "host_only_or_injection_sensitive",
      "currentStatus": "some values can currently cross through ambient inheritance; explicit deletion is separately recorded per key",
      "targetStatus": "absent from provider execution units",
      "memberKeyEvidenceIds": [
        "env-key:AGENT_TEAMS_DISABLE_GPU",
        "env-key:AGENT_TEAMS_ELECTRON_CLAUDE_ROOT",
        "env-key:AGENT_TEAMS_ELECTRON_USER_DATA_DIR",
        "env-key:AGENT_TEAMS_TOKEN_USAGE_CCUSAGE_ARGS",
        "env-key:AGENT_TEAMS_TOKEN_USAGE_CCUSAGE_COMMAND",
        "env-key:AGENT_TEAMS_TOKEN_USAGE_CCUSAGE_JSON",
        "env-key:AGENT_TEAMS_TOKEN_USAGE_COMMAND_REFRESH_MS",
        "env-key:AGENT_TEAMS_TOKEN_USAGE_TOKSCALE_ARGS",
        "env-key:AGENT_TEAMS_TOKEN_USAGE_TOKSCALE_COMMAND",
        "env-key:AGENT_TEAMS_TOKEN_USAGE_TOKSCALE_JSON",
        "env-key:BUILD_ID",
        "env-key:CLAUDE_AGENT_TEAMS_ORCHESTRATOR_CLI_PATH",
        "env-key:CLAUDE_APP_DISABLE_DETERMINISTIC_TEAM_BOOTSTRAP",
        "env-key:CLAUDE_CLI_PATH",
        "env-key:CLAUDE_CONTEXT_DISABLE_CACHE",
        "env-key:CLAUDE_DEVTOOLS_STRICT_SESSION_FILTER",
        "env-key:CLAUDE_DISABLE_DETERMINISTIC_TEAM_BOOTSTRAP",
        "env-key:CLAUDE_HOOK_JUDGE_MODE",
        "env-key:CLAUDE_ROOT",
        "env-key:CLAUDE_SKIP_ANALYTICS",
        "env-key:CLAUDE_TEAM_BOARD_TASK_ACTIVITY_READ_ENABLED",
        "env-key:CLAUDE_TEAM_BOARD_TASK_EXACT_LOGS_READ_ENABLED",
        "env-key:CLAUDE_TEAM_CLI_FLAVOR",
        "env-key:CLAUDE_TEAM_CODEX_NATIVE_TRACE_FALLBACK_ENABLED",
        "env-key:CLAUDE_TEAM_ANTHROPIC_AUTH_MODE_API_KEY_HELPER",
        "env-key:AGENT_TEAMS_RUNTIME_TURN_SETTLED_*",
        "env-key:AGENT_TEAMS_MCP_*",
        "env-key:CLAUDE_TEAM_BOOTSTRAP_*",
        "env-key:CLAUDE_TEAM_DISABLE_MCP_ORPHAN_CLEANUP",
        "env-key:CLAUDE_TEAM_ENABLE_PERSISTED_TASK_CHANGE_CACHE",
        "env-key:CLAUDE_TEAM_ENABLE_TASK_CHANGE_WORKER",
        "env-key:CLAUDE_TEAM_EVENT_LOOP_LAG_MONITOR_ENABLED",
        "env-key:CLAUDE_TEAM_OPENCODE_ALLOW_AUTOUPDATE",
        "env-key:CLAUDE_TEAM_OPENCODE_MCP_HTTP",
        "env-key:CLAUDE_TEAM_OPENCODE_MCP_HTTP_PORT",
        "env-key:CLAUDE_TEAM_OPENCODE_PROMPT_DELIVERY_WATCHDOG",
        "env-key:CLAUDE_TEAM_OPENCODE_TASK_CHANGE_DIAG",
        "env-key:CLAUDE_TEAM_OPENCODE_TASK_STALL_REMEDIATION_ENABLED",